{
  "$schema": "https://json-schema.org/draft/2020-12/schema",
  "$id": "https://phaseform.dev/schema/0.1.0/phaseform.project.schema.json",
  "title": "PHASEFORM project",
  "description": "A PHASEFORM v0.1 project file: scene list, entry scene and asset manifest. Structure only: key uniqueness, entry membership, texture references and scene key matching are defined in docs/PROJECT.md and enforced by the loader.",
  "type": "object",
  "required": ["format", "version", "name", "entry", "scenes", "assets"],
  "properties": {
    "format": { "const": "phaseform-project" },
    "version": {
      "type": "string",
      "pattern": "^(0|[1-9][0-9]*)\\.(0|[1-9][0-9]*)\\.(0|[1-9][0-9]*)(-[0-9A-Za-z.-]+)?(\\+[0-9A-Za-z.-]+)?$"
    },
    "name": { "type": "string", "minLength": 1 },
    "entry": { "type": "string", "minLength": 1, "description": "Key of the scene that starts first. Must be one of the scene keys." },
    "scenes": {
      "type": "array",
      "minItems": 1,
      "items": { "$ref": "#/$defs/sceneEntry" }
    },
    "assets": {
      "type": "array",
      "items": { "$ref": "#/$defs/asset" }
    },
    "extensions": { "$ref": "#/$defs/extensions" }
  },
  "additionalProperties": true,

  "$defs": {
    "extensions": {
      "type": "object",
      "propertyNames": { "pattern": "^[a-z][a-z0-9-]*$" }
    },

    "path": {
      "type": "string",
      "minLength": 1,
      "not": { "pattern": "\\\\|^/|^[A-Za-z]:|(^|/)\\.\\.(/|$)" },
      "description": "Path relative to the project root, forward slashes, no leading slash, drive letter, or parent traversal."
    },

    "sceneEntry": {
      "type": "object",
      "required": ["key", "path"],
      "properties": {
        "key": { "type": "string", "minLength": 1 },
        "path": { "$ref": "#/$defs/path" },
        "assets": {
          "type": "array",
          "items": { "type": "string", "minLength": 1 },
          "description": "Asset keys to preload for this scene. Omit to preload all."
        },
        "extensions": { "$ref": "#/$defs/extensions" }
      },
      "additionalProperties": true
    },

    "asset": {
      "type": "object",
      "required": ["key", "type"],
      "properties": {
        "key": { "type": "string", "minLength": 1 },
        "type": { "type": "string", "minLength": 1, "description": "Open registry: unknown types are valid and must be preserved." },
        "extensions": { "$ref": "#/$defs/extensions" }
      },
      "additionalProperties": true,
      "allOf": [
        {
          "if": { "properties": { "type": { "const": "image" } }, "required": ["type"] },
          "then": { "required": ["url"], "properties": { "url": { "$ref": "#/$defs/path" } } }
        },
        {
          "if": { "properties": { "type": { "const": "spritesheet" } }, "required": ["type"] },
          "then": {
            "required": ["url", "frameWidth", "frameHeight"],
            "properties": {
              "url": { "$ref": "#/$defs/path" },
              "frameWidth": { "type": "integer", "minimum": 1 },
              "frameHeight": { "type": "integer", "minimum": 1 },
              "startFrame": { "type": "integer", "minimum": 0 },
              "endFrame": { "type": "integer", "minimum": 0 },
              "margin": { "type": "integer", "minimum": 0 },
              "spacing": { "type": "integer", "minimum": 0 },
              "frames": { "type": "integer", "minimum": 1, "description": "Optional frame count, lets tools check integer frame indices." }
            }
          }
        },
        {
          "if": { "properties": { "type": { "const": "atlas" } }, "required": ["type"] },
          "then": {
            "required": ["url", "atlasUrl"],
            "properties": {
              "url": { "$ref": "#/$defs/path" },
              "atlasUrl": { "$ref": "#/$defs/path" }
            }
          }
        },
        {
          "if": { "properties": { "type": { "const": "audio" } }, "required": ["type"] },
          "then": {
            "required": ["urls"],
            "properties": {
              "urls": { "type": "array", "minItems": 1, "items": { "$ref": "#/$defs/path" } }
            }
          }
        }
      ]
    }
  }
}
